[
  {
    "id": "FLT-SCN-019",
    "domain": "D08",
    "sub_domain": "Unexplained float improvement",
    "type": "scenario",
    "career_level": "manager",
    "bloom_level": 6,
    "scenario_level": 4,
    "scenario": {
      "en": "You are Planning Manager. Your team's draft monthly report shows Project Total Float improving from −30 to −5 days in one month. Site progress was average, no recovery measures were implemented, and the client's PMC will receive the report in two days.",
      "ar": "أنت Planning Manager. مسودة التقرير الشهري من فريقك تظهر تحسن الـ Project Total Float من −30 إلى −5 خلال شهر واحد. التقدم في الموقع كان متوسطًا، ولم تُنفذ إجراءات Recovery، والتقرير سيذهب لاستشاري العميل (PMC) بعد يومين."
    },
    "question": {
      "en": "What do you do before the report is issued?",
      "ar": "ماذا تفعل قبل إصدار التقرير؟"
    },
    "thinking_objectives": ["Schedule integrity as a management responsibility", "Credibility with the client", "Explaining float movements"],
    "model_answer": {
      "en": "A 25-day gain without recovery measures is not credible until explained, and issuing it unexplained damages the team's credibility with the PMC, who will compare the programmes. I would ask the planner for a variance explanation within a day: compare this update with the last one for changed durations (remaining durations cut), deleted or added activities, relationship changes (FS changed to SS, removed links), changed or removed constraints, calendar changes (e.g., switching to a 7-day calendar), lag changes, and the scheduling option (Retained Logic vs Progress Override). For each change, I need the justification and approval: approved resequencing, a re-estimate supported by achieved productivity, an approved change order. Legitimate changes stay and are disclosed in the report narrative. Unjustified changes are reversed. If the explanation is incomplete in two days, I issue the report with the float as recalculated on the justified logic, not the optimistic figure. I'd also put a control in place: a variance check against the previous update before every report.",
      "ar_explanation": "مكسب 25 يومًا بدون Recovery غير موثوق حتى يُفسَّر، وإصداره بدون تفسير يضر مصداقية الفريق أمام الـ PMC الذي سيقارن البرامج. أطلب تفسيرًا خلال يوم: مقارنة المدد، الأنشطة المحذوفة/المضافة، العلاقات (FS إلى SS)، الـ Constraints، الـ Calendars، الـ Lags، وخيار Retained Logic أو Progress Override. كل تغيير يحتاج مبررًا وموافقة. المبرر يبقى ويُذكر في التقرير، وغير المبرر يُلغى. وأضع ضابطًا دائمًا: مقارنة بالتحديث السابق قبل كل تقرير."
    },
    "evaluation": {
      "required_points": [
        { "id": "not_credible", "text": "Treats the gain as suspect until explained", "weight": 2 },
        { "id": "compare_updates", "text": "Compares with previous update: durations, logic, constraints, calendars", "weight": 2.5 },
        { "id": "justify_or_reverse", "text": "Keeps justified changes (disclosed), reverses unjustified ones", "weight": 2 }
      ],
      "acceptable_points": [
        { "id": "credibility", "text": "Considers credibility with client/PMC" }
      ],
      "advanced_points": [
        { "id": "scheduling_option", "text": "Retained Logic vs Progress Override switch as a cause" },
        { "id": "process_control", "text": "Introduces a standing variance check" },
        { "id": "narrative", "text": "Discloses legitimate changes in the report narrative" }
      ],
      "red_flags": [
        { "id": "issue_good_news", "text": "Issues the report as good news", "severity": "critical" },
        { "id": "blame_planner", "text": "Only blames the planner without investigating", "severity": "minor" }
      ],
      "scenario_dependent": true
    },
    "follow_ups": [
      {
        "id": "f1", "trigger": "what_if",
        "question": { "en": "The planner explains: the client approved deleting the basement car-park ramp works (a scope reduction). Does that settle it?", "ar": "المخطط فسّر: العميل وافق على حذف أعمال منحدر الجراج (تخفيض نطاق). هل هذا يحسم الأمر؟" },
        "expects": ["Check the ramp was on the driving path and accounts for the gain", "Verify approval document; disclose in report"]
      }
    ],
    "misconceptions": ["Float improvements are always good news"],
    "related": ["FLT-APP-010", "BSL-JDG-001"],
    "p6_relevance": "medium",
    "real_world_relevance": "high",
    "tags": ["float", "reporting", "integrity", "management"],
    "status": "reviewed"
  },
  {
    "id": "FLT-TRB-020",
    "domain": "D08",
    "sub_domain": "Critical filter shows nothing",
    "type": "troubleshooting",
    "career_level": "planning_engineer",
    "bloom_level": 5,
    "scenario_level": 2,
    "scenario": {
      "en": "After scheduling, your 'Critical activities' filter (Total Float ≤ 0) returns no activities. The scheduled finish is 45 days before the contract completion date entered as the Project Must Finish By.",
      "ar": "بعد الجدولة، فلتر «الأنشطة الحرجة» (Total Float ≤ 0) لا يُرجع أي نشاط. تاريخ الانتهاء المحسوب قبل تاريخ الإنجاز التعاقدي (المُدخل كـ Must Finish By) بـ 45 يومًا."
    },
    "question": {
      "en": "Why is the filter empty, and how should you show the critical path? Is the 45-day margin itself something to check?",
      "ar": "لماذا الفلتر فارغ، وكيف يجب إظهار المسار الحرج؟ وهل هامش الـ 45 يومًا نفسه يحتاج فحصًا؟"
    },
    "thinking_objectives": ["Effect of a late imposed date on float", "Questioning a too-good result"],
    "model_answer": {
      "en": "The backward pass starts from the Must Finish By date, 45 days after the calculated finish, so the driving path carries +45 days of float and nothing meets TF ≤ 0. Options: define critical activities as Longest Path in Schedule Options, or use a threshold of TF ≤ 45 for this project; never delete or move the contractual date just to make the filter work. The +45 itself must be checked: is it a genuine programmed early finish, or a symptom of missing scope (activities not yet included — testing & commissioning, authority approvals, snagging, handover), missing logic (open ends), optimistic durations, or a calendar that is too generous (7-day work without approval)? An early-finish programme also has commercial implications — some employers will not accept a programme finishing well before the contract date without discussion.",
      "ar_explanation": "الـ Backward Pass يبدأ من الـ Must Finish By المتأخر 45 يومًا، فالمسار القائد يحمل +45 ولا يحقق أي نشاط TF ≤ 0. الحل: تعريف الحرجية بالـ Longest Path أو حد TF ≤ 45، ولا تحذف التاريخ التعاقدي أبدًا. لكن الـ +45 نفسه يحتاج فحصًا: هل الانتهاء المبكر حقيقي، أم بسبب نطاق ناقص (T&C، موافقات الجهات، التسليم)، أو منطق ناقص، أو مدد متفائلة، أو Calendar سبعة أيام بدون موافقة؟"
    },
    "evaluation": {
      "required_points": [
        { "id": "positive_float", "text": "Driving path has +45 because of the later imposed date", "weight": 2.5 },
        { "id": "longest_path_fix", "text": "Use Longest Path or an adjusted threshold", "weight": 2 },
        { "id": "keep_contract_date", "text": "Does not remove/move the contract date to fix the filter", "weight": 1 }
      ],
      "acceptable_points": [
        { "id": "verify_margin", "text": "Questions whether +45 is realistic" }
      ],
      "advanced_points": [
        { "id": "missing_scope", "text": "Missing scope (T&C, approvals, handover) as a cause" },
        { "id": "commercial", "text": "Commercial implication of an early-finish programme" }
      ],
      "red_flags": [
        { "id": "no_critical_path", "text": "Concludes the project has no critical path", "severity": "critical" }
      ]
    },
    "follow_ups": [
      {
        "id": "f1", "trigger": "if_missing", "ref_point": "missing_scope",
        "question": { "en": "Which typically forgotten activities at the end of a building project could explain an apparent 45-day margin?", "ar": "ما الأنشطة التي تُنسى عادة في نهاية مشروع مبنى ويمكن أن تفسر هامش 45 يومًا الظاهري؟" },
        "expects": ["Testing & commissioning, authority inspections (civil defence, utilities)", "Snagging/de-snagging, handover documentation, O&M training"]
      }
    ],
    "mutation": { "margin_days": [45, 10, 90] },
    "misconceptions": ["No activities with zero float means no critical path"],
    "related": ["FLT-CON-005", "FLT-APP-011"],
    "p6_relevance": "high",
    "real_world_relevance": "high",
    "tags": ["float", "critical-path", "p6", "must-finish-by"],
    "status": "reviewed"
  },
  {
    "id": "FLT-TRB-021",
    "domain": "D08",
    "sub_domain": "Inconsistent float along a path",
    "type": "troubleshooting",
    "career_level": "senior",
    "bloom_level": 5,
    "scenario_level": 3,
    "scenario": {
      "en": "A chain of three activities is linked FS with zero lag: X → Y → Z. Each has only that one successor and Free Float is 0 on X and Y. P6 shows Total Float: X = 12 d, Y = 12 d, Z = 15 d.",
      "ar": "سلسلة من ثلاثة أنشطة مربوطة FS بدون Lag: X ← Y ← Z. كل نشاط له Successor واحد فقط، والـ Free Float لـ X و Y = صفر. P6 يظهر Total Float: X = 12 يوم، Y = 12 يوم، Z = 15 يوم."
    },
    "question": {
      "en": "On a simple chain the float should be the same. Why could Z show 15 days?",
      "ar": "في سلسلة بسيطة يُفترض أن يكون الـ Float متساويًا. لماذا قد يظهر Z بـ 15 يومًا؟"
    },
    "thinking_objectives": ["Calendar-based float display", "Hidden logic and constraints"],
    "model_answer": {